,file,input_text,target_text
276,CMU/AFGP-2002-600045-Trans.xml,"LU Factuality: The candidate should not be in question when it comes to religion, integrity or his morality.","(comes, certain); (should, certain); (be, unknown)"
277,CMU/AFGP-2002-600045-Trans.xml,LU Factuality: Reciting the pledge of AL-QAEDA.,"(Reciting, certain); (pledge, certain)"
278,CMU/AFGP-2002-600045-Trans.xml,LU Factuality: AL-QAEDA's  Regulations and Instructions:  ,"(Regulations, certain)"
279,CMU/AFGP-2002-600045-Trans.xml,LU Factuality: Duties ,"(Duties, certain)"
280,CMU/AFGP-2002-600045-Trans.xml,"LU Factuality: Preserving the unity of AL QAEDA is an important and legitimate goal, which occurs by fearing God in private as well as in public.","(occurs, certain); (fearing, certain); (Preserving, certain); (unity, certain); (is, certain)"
281,CMU/AFGP-2002-600045-Trans.xml,"LU Factuality: This is fulfilled  through humbleness and flexibility towards the brothers and the rest of the Muslims, good manners, rejection of disputes, and mutual agreement and settlement of differences.","(fulfilled, certain); (humbleness, certain); (settlement, certain); (agreement, certain); (differences, certain); (manners, certain); (flexibility, certain); (disputes, certain); (rejection, certain)"
282,CMU/AFGP-2002-600045-Trans.xml,"LU Factuality: Preserving Islamic morals and avoiding means of corruption and bad companions, through verification  and confirmation of news.","(Preserving, certain); (confirmation, certain); (avoiding, certain); (verification, certain); (corruption, certain)"
283,CMU/AFGP-2002-600045-Trans.xml,LU Factuality: To observe good conduct and filial piety even if they were infidels.,"(observe, certain); (piety, certain); (conduct, certain); (were, certain)"
284,CMU/AFGP-2002-600045-Trans.xml,LU Factuality: Adherence to eating Islamic Halal food (T.C: Koranic verse).,"(eating, certain); (Adherence, certain)"
285,CMU/AFGP-2002-600045-Trans.xml,LU Factuality: Maintaining physical fitness and military exercises as much as possible.,"(much, certain); (fitness, certain); (exercises, certain); (Maintaining, certain)"
286,CMU/AFGP-2002-600045-Trans.xml,"LU Factuality: Do not talk about work assigned by AL-QAEDA with others, even if they are AL-QAEDA members.","(talk, certain); (are, certain); (work, certain); (assigned, certain)"
287,CMU/AFGP-2002-600045-Trans.xml,"LU Factuality: The only person you can discuss work with is your direct commander (Amir), unless you  are asked to do otherwise or if your work demands participation of others, and then through guidance of the leadership.","(do, certain); (work, certain); (work, certain); (asked, certain); (discuss, certain); (leadership, certain); (guidance, certain); (participation, certain); (demands, certain)"
288,CMU/AFGP-2002-600045-Trans.xml,"LU Factuality: The call to adhere to Islam in general, and spreading the concept of Jihad specifically, starts with relatives and friends.","(Jihad, certain); (spreading, certain); (adhere, certain); (call, certain); (starts, certain)"
289,CMU/AFGP-2002-600045-Trans.xml,"LU Factuality: You may not be able to do this, if your work demands extreme secrecy, like Naeem IBn Mas'uud (May God bless him).","(demands, certain); (work, certain); (may, certain); (bless, unknown); (be, uncertain); (do, uncertain)"
290,CMU/AFGP-2002-600045-Trans.xml,LU Factuality: Safeguard AL-QAEDA's general funds and do not mishandle these funds.,"(mishandle, certain); (Safeguard, certain)"
291,CMU/AFGP-2002-600045-Trans.xml,"LU Factuality: Sincerity in providing advice to commanders and to your brethren in AL-QAEDA, without harboring deception.","(advice, certain); (providing, certain); (harboring, certain)"
292,CMU/AFGP-2002-600045-Trans.xml,LU Factuality: Vacations ,"(Vacations, certain)"
293,CMU/AFGP-2002-600045-Trans.xml,"LU Factuality: The married have a vacation by rotation for a week every three weeks, and in certain cases AL-QAEDA may deny this vacation for four months.","(may, certain); (have, certain); (vacation, certain); (deny, uncertain)"
294,CMU/AFGP-2002-600045-Trans.xml,LU Factuality: A bachelor can have a vacation by rotation for five days every month.,"(have, certain)"
295,CMU/AFGP-2002-600045-Trans.xml,LU Factuality: ALQAEDA may deny his request for vacation in certain cases.,"(vacation, certain); (request, certain); (may, certain); (deny, uncertain)"
296,CMU/AFGP-2002-600045-Trans.xml,LU Factuality: Request for vacation travel should be submitted two and a half  months before the travel date.,"(Request, certain); (should, certain); (travel, certain); (submitted, unknown)"
297,CMU/AFGP-2002-600045-Trans.xml,"LU Factuality: The request would only be considered if it had been submitted in a timely manner as indicated, except in special cases.","(would, certain); (request, certain); (indicated, certain); (submitted, certain); (considered, unknown)"
298,CMU/AFGP-2002-600045-Trans.xml,"LU Factuality: The salary of a married Mujahed brother is 6500 Pakistani Rupee, and 500 Rupee for every newborn.","(is, certain)"
299,CMU/AFGP-2002-600045-Trans.xml,LU Factuality: Salary of the bachelor Mujahed is 1000 Pakistani Rupee ,"(is, certain)"
300,CMU/AFGP-2002-600045-Trans.xml,LU Factuality: The bachelor Mujahed qualifies for a round trip ticket to his country after one year from joining the organization.,"(qualifies, certain); (joining, certain)"
301,CMU/AFGP-2002-600045-Trans.xml,LU Factuality: He can take a one month vacation.,"(take, certain); (vacation, certain)"
302,CMU/AFGP-2002-600045-Trans.xml,"LU Factuality: He doesn't get reimbursed if the ticket is not used, but he has the right to change it to a ticket to perform the pilgrimage.","(has, certain); (change, certain); (pilgrimage, certain); (reimbursed, certain); (used, certain); (perform, unknown)"
303,CMU/AFGP-2002-600045-Trans.xml,LU Factuality: This period starts from the date of  joining AL-QAEDA.,"(starts, certain); (joining, certain)"
304,CMU/AFGP-2002-600045-Trans.xml,"LU Factuality: The married Mujahed and his family qualify for round trip tickets to their country of origin after two years, and one month vacation.","(qualify, certain)"
305,CMU/AFGP-2002-600045-Trans.xml,LU Factuality: Tickets can not be reimbursed if unused.,"(reimbursed, certain); (unused, certain)"
306,CMU/AFGP-2002-600045-Trans.xml,LU Factuality: The brother who wants to leave AL-QAEDA without a legitimate excuse does not qualify for financial assistance or any of the previously mentioned privileges .,"(mentioned, certain); (assistance, certain); (qualify, certain); (wants, certain); (leave, unknown)"
307,CMU/AFGP-2002-600045-Trans.xml,LU Factuality: Reward and Punishment ,"(Reward, certain)"
308,CMU/AFGP-2002-600045-Trans.xml,LU Factuality: AL-QAEDA missions and its different plans proceed according to Islamic law provision.,"(provision, certain); (according, certain); (proceed, certain); (plans, certain); (missions, certain)"
309,CMU/AFGP-2002-600045-Trans.xml,"LU Factuality: Disputes related to AL-QAEDA missions between member brethren should be judged by qualified personnel, which is carried out by the immediate commander (Amir) of the conflicting parties.","(related, certain); (Disputes, certain); (carried, certain); (should, certain); (missions, certain); (judged, unknown)"
310,CMU/AFGP-2002-600045-Trans.xml,LU Factuality: He must inform the officials to settle the matter.,"(must, certain); (inform, unknown); (settle, unknown)"
311,CMU/AFGP-2002-600045-Trans.xml,LU Factuality: Personal disputes between member brethren could be judged by qualified members of AL-QAEDA or outsiders.,"(disputes, certain); (could, certain); (judged, uncertain)"
312,CMU/AFGP-2002-600045-Trans.xml,LU Factuality: Corrupted courts should not judge the matter.,"(should, certain); (judge, unknown)"
313,CMU/AFGP-2002-600045-Trans.xml,LU Factuality: All members commanders as well as subordinates must obey these rules.,"(must, certain); (obey, unknown)"
314,CMU/AFGP-2002-600045-Trans.xml,LU Factuality: Advice ,"(Advice, certain)"
315,CMU/AFGP-2002-600045-Trans.xml,"LU Factuality: Maintain provision of legitimate justice, and justice is the establishing the human's behavior in religion.","(justice, certain); (establishing, certain); (provision, certain); (justice, certain); (Maintain, certain)"
316,CMU/AFGP-2002-600045-Trans.xml,LU Factuality: Two points are considered: ,"(considered, certain)"
317,CMU/AFGP-2002-600045-Trans.xml,LU Factuality: Piety in religion:   ,"(Piety, certain)"
318,CMU/AFGP-2002-600045-Trans.xml,LU Factuality: Perform religious duties according to certain supererogatory exercises of devotion.,"(according, certain); (exercises, certain); (Perform, certain); (duties, certain)"
319,CMU/AFGP-2002-600045-Trans.xml,"LU Factuality: Avoid the forbidden, one should abstain from great or minor sins.","(should, certain); (Avoid, certain); (sins, certain); (abstain, unknown)"
320,CMU/AFGP-2002-600045-Trans.xml,LU Factuality: Practising chivalry:  i,"(Practising, certain)"
321,CMU/AFGP-2002-600045-Trans.xml,LU Factuality: One should adopt whatever makes him look good and avoid what degrades him.,"(degrades, certain); (makes, certain); (should, certain); (avoid, certain); (look, certain)"
322,CMU/AFGP-2002-600045-Trans.xml,LU Factuality: Exert your utmost and every conceivable effort for the sake of achieving the rightful objectives of ALQAEDA.,"(objectives, certain); (Exert, certain); (sake, certain); (effort, certain); (achieving, unknown)"
323,CMU/AFGP-2002-600045-Trans.xml,LU Factuality: The sign of truth is: ,"(sign, certain); (is, certain)"
324,CMU/AFGP-2002-600045-Trans.xml,LU Factuality: Your effort in serving your religion is greater than the effort exerted in your worldly matters and your family.,"(effort, certain); (matters, certain); (serving, certain); (is, certain); (effort, certain); (exerted, certain)"
325,CMU/AFGP-2002-600045-Trans.xml,LU Factuality: Your effort in serving your religion should be greater than the effort exerted by the infidels to support their lies .,"(effort, certain); (exerted, certain); (effort, certain); (serving, certain); (should, certain); (be, unknown); (support, unknown)"
326,CMU/AFGP-2002-600045-Trans.xml,"LU Factuality: Thorough study of legal curricula, and utilizing time in doing this, and thereby providing the Muslim brother with an Islamic vision for contemporary events.","(doing, certain); (providing, certain); (vision, certain); (events, certain); (study, certain); (utilizing, certain)"
327,CMU/AFGP-2002-600045-Trans.xml,"LU Factuality: Knowledge without work is a burden on the person, and knowledge without work is useless.","(is, certain); (work, certain); (knowledge, certain); (is, certain); (work, certain); (Knowledge, certain)"
328,CMU/AFGP-2002-600045-Trans.xml,"LU Factuality: If you are a specialist in any field, then you have to master your specialization.","(have, certain); (are, certain); (master, unknown)"
329,CMU/AFGP-2002-600045-Trans.xml,"LU Factuality: If you could serve the objectives of AL-QAEDA  through your specialization, than inform your leadership of that.","(inform, certain); (objectives, certain); (could, certain); (serve, uncertain)"
330,CMU/AFGP-2002-600045-Trans.xml,"LU Factuality: The brethren are advised to avoid disagreement and argument in religion, discussing  religion without proper knowledge is prohibited , and questions of differences are referred to powerful knowledgeable leaders.","(discussing, certain); (argument, certain); (disagreement, certain); (avoid, certain); (advised, certain); (differences, certain); (referred, certain); (knowledge, certain); (prohibited, certain)"
331,CMU/AFGP-2002-600045-Trans.xml,LU Factuality: The pledge ,"(pledge, certain)"
332,CMU/AFGP-2002-600045-Trans.xml,LU Factuality: Its legitimacy and its purpose:   ,"(purpose, certain)"
333,CMU/AFGP-2002-600045-Trans.xml,LU Factuality: The legitimacy of the pledge: ,"(pledge, certain)"
334,CMU/AFGP-2002-600045-Trans.xml,LU Factuality: Pledges among Muslims concerning obedience and permissibility is legitimate and conceivable so that every party trusts the other.,"(trusts, certain); (is, certain); (conceivable, certain); (obedience, certain); (permissibility, certain); (Pledges, certain)"
335,CMU/AFGP-2002-600045-Trans.xml,"LU Factuality: So if a Muslim vows to do something, he must fulfill it.","(must, certain); (vows, certain); (fulfill, unknown); (do, unknown)"
336,CMU/AFGP-2002-600045-Trans.xml,LU Factuality: The purpose of the pledge: ,"(purpose, certain); (pledge, certain)"
337,CMU/AFGP-2002-600045-Trans.xml,"LU Factuality: Matters subject to pledge are either legitimate or permissible duties, legitimate duties like Jihad and obedience to leaders is first in importance.","(subject, certain); (pledge, certain); (Matters, certain); (Jihad, certain); (obedience, certain); (are, certain); (duties, certain); (is, certain)"
338,CMU/AFGP-2002-600045-Trans.xml,"LU Factuality: A legitimate duty for a Muslim and a pledge conforms what is a duty by law, and it is a duty even if it is not subject to a pledge.","(pledge, certain); (conforms, certain); (duty, certain); (is, certain); (pledge, certain); (is, certain); (is, certain)"
339,CMU/AFGP-2002-600045-Trans.xml,"LU Factuality: According to what has been previously mentioned, than AL-QAEDA secures the pledge of its followers, which includes commitment to its policies and objectives preceded by the commander's (Amir) pledge.","(pledge, certain); (secures, certain); (mentioned, certain); (According, certain); (objectives, certain); (policies, certain); (commitment, certain); (includes, certain); (pledge, certain); (preceded, certain)"
340,CMU/AFGP-2002-600045-Trans.xml,"LU Factuality: I pledge by God's creed to become a Muslim soldier to support God's religion, and may God 's word be the most supreme.","(creed, certain); (pledge, certain); (be, certain); (may, unknown); (support, unknown); (become, unknown)"
341,CMU/AFGP-2002-600045-Trans.xml,"LU Factuality: I pledge to adhere to the holy book  and Assuna and commit to the brothers committed with us in this mission, so God is my witness.","(pledge, certain); (commit, unknown); (adhere, unknown); (committed, certain); (is, unknown)"
342,CMU/AFGP-2002-600045-Trans.xml,LU Factuality: An oath from the Mujahed brother: ,"(oath, certain)"
343,CMU/AFGP-2002-600045-Trans.xml,"LU Factuality: I vow by God's creed to obey those responsible in this mission, in thick and thin, and thereupon may God 's word be most supreme.","(vow, certain); (may, unknown); (obey, unknown); (be, certain); (creed, certain); (mission, certain)"
344,CMU/AFGP-2002-600045-Trans.xml,"LU Factuality: By supporting God's religion, I am a warrior in this mission regardless of my position, as long as the work is existing.","(supporting, certain); (am, certain); (mission, certain); (existing, certain); (work, certain)"
345,CMU/AFGP-2002-600045-Trans.xml,"LU Factuality: I have to preserve the secrecy of work in AL-QAEDA , so God is my witness.","(preserve, unknown); (is, unknown); (have, certain); (work, certain)"
346,CMU/AFGP-2002-600045-Trans.xml,LU Factuality: Seven: Breaking the pledge ,"(Breaking, certain); (pledge, certain)"
347,CMU/AFGP-2002-600045-Trans.xml,LU Factuality: The sin of the Breaker of the pledge (Suraat Alraa'd) (Albukhari) (Fath Albari 418/4) ,"(sin, certain); (Breaker, certain); (pledge, certain)"
348,CMU/AFGP-2002-600045-Trans.xml,LU Factuality: Our last prayer is to thank God the creator of the universe.,"(is, certain); (thank, unknown)"
349,CMU/AFGP-2002-600175-Trans.xml,"LU Factuality: In the name of Allah, the Most Benevolent, ever Merciful","(Merciful, unknown)"
350,CMU/AFGP-2002-600175-Trans.xml,"LU Factuality: Praise Allah, and prayer and peace upon the Messenger sent by Allah","(sent, certain); (Praise, unknown); (upon, unknown)"
351,CMU/AFGP-2002-600175-Trans.xml,LU Factuality: Take refuge in Allah from the accursed Satan,"(Take, certain)"
352,CMU/AFGP-2002-600175-Trans.xml,"LU Factuality: ""So, fight them till all opposition ends, and obedience is wholly Allah's"".","(obedience, uncertain); (is, uncertain); (fight, uncertain); (ends, uncertain); (opposition, uncertain)"
353,CMU/AFGP-2002-600175-Trans.xml,"LU Factuality: ""If they break their pledge after giving their word and revile your faith, fight these specimens of faithlessness, for surely their oaths have no sanctity: they may happily desist.""","(faithlessness, uncertain); (oaths, uncertain); (have, uncertain); (may, uncertain); (desist, unknown); (break, uncertain); (pledge, uncertain); (giving, uncertain); (revile, uncertain); (fight, uncertain); (faith, uncertain)"
354,CMU/AFGP-2002-600175-Trans.xml,"LU Factuality: ""Fight them so that Allah may punish them at your hands, and put them to shame, and help you against them, and heal the woundsi of the hearts of the believers, And remove the anger from their breasts; for Allah turns to whosoever desires . Allah is all- knowing and all - wise.""","(Fight, uncertain); (may, uncertain); (put, uncertain); (punish, unknown); (is, uncertain); (desires, uncertain); (turns, uncertain); (anger, uncertain); (remove, uncertain); (wounds, uncertain); (heal, uncertain); (help, uncertain); (to, uncertain)"
355,CMU/AFGP-2002-600175-Trans.xml,"LU Factuality: ""What has happened to you, O believers, that when you are asked to set out in the cause of Allah your feet begin to drag ? ","(drag, uncertain); (begin, uncertain); (cause, uncertain); (set, uncertain); (asked, uncertain); (happened, unknown)"
356,CMU/AFGP-2002-600175-Trans.xml,LU Factuality: Do you find the life of the world so pleasing that you forget the life to come ? ,"(come, unknown); (forget, unknown); (pleasing, unknown); (find, unknown)"
357,CMU/AFGP-2002-600175-Trans.xml,"LU Factuality: Yet the profit of the life of this world is but meager as compared to the life to come.  "" ","(is, uncertain); (compared, uncertain)"
358,CMU/AFGP-2002-600175-Trans.xml,"LU Factuality: An Islamic Group, its only mission is Jihad, because Jihad is one of the basic purposes for which Al Qaeda personnel come together.","(is, certain); (mission, certain); (come, certain); (is, certain); (Jihad, certain)"
359,CMU/AFGP-2002-600175-Trans.xml,"LU Factuality: In addition, they perform other Islamic duties if possible.","(duties, certain); (perform, certain)"
360,CMU/AFGP-2002-600175-Trans.xml,LU Factuality: Jihad will take precedence over other duties in case of interference.,"(duties, certain); (Jihad, certain); (take, certain); (interference, uncertain)"
361,CMU/AFGP-2002-600175-Trans.xml,LU Factuality: Its belief:,"(belief, certain)"
362,CMU/AFGP-2002-600175-Trans.xml,"LU Factuality: The belief of the Sunnite and the assembled people in general and in detail, and following the traditions of the noble ancestors.","(belief, certain); (traditions, certain); (following, certain)"
363,CMU/AFGP-2002-600175-Trans.xml,LU Factuality: Goals of Al Qaeda:,"(Goals, certain)"
364,CMU/AFGP-2002-600175-Trans.xml,"LU Factuality: The victory of the mighty religion of Allah, the establishment of an Islamic Regime and the restoration of the Islamic Caliphate, God willing.","(Caliphate, certain); (willing, unknown); (restoration, certain); (establishment, certain); (Regime, certain); (victory, certain)"
365,CMU/AFGP-2002-600175-Trans.xml,LU Factuality: Al Qaeda work parameters:,"(parameters, certain)"
366,CMU/AFGP-2002-600175-Trans.xml,"LU Factuality: International and in gradual stages, depending on Al Qaeda policies.","(depending, certain)"
367,CMU/AFGP-2002-600175-Trans.xml,LU Factuality: Conditions for admission into Al Qaeda:,"(admission, certain)"
368,CMU/AFGP-2002-600175-Trans.xml,"LU Factuality: The compliance with Al Qaeda beliefs and goals, as have been explained previously.","(goals, certain); (beliefs, certain); (explained, certain); (compliance, certain)"
369,CMU/AFGP-2002-600175-Trans.xml,LU Factuality: Subordination and obedience to the higher command without rebellion against God's way.,"(Subordination, certain); (rebellion, certain); (obedience, certain)"
370,CMU/AFGP-2002-600175-Trans.xml,LU Factuality: It is forbidden to have membership with another Islamic Group beside Al Qaeda membership.,"(have, certain); (forbidden, certain); (membership, certain)"
371,CMU/AFGP-2002-600175-Trans.xml,LU Factuality: Operation Security.,"(Security, certain)"
372,CMU/AFGP-2002-600175-Trans.xml,LU Factuality: Good physical fitness (except in administration ( [sic],"(fitness, certain)"
373,CMU/AFGP-2002-600175-Trans.xml,"LU Factuality: The candidate must not be suspected of lacking religion, fairness and morality.","(must, certain); (lacking, certain); (fairness, certain); (morality, certain); (suspected, unknown)"
374,CMU/AFGP-2002-600175-Trans.xml,LU Factuality: Taking the pledge of allegiance.,"(pledge, certain); (Taking, certain)"
375,CMU/AFGP-2002-600175-Trans.xml,LU Factuality: Articles and Instructions of Al Qaeda,"(Instructions, certain); (Articles, certain)"
376,CMU/AFGP-2002-600175-Trans.xml,LU Factuality: It is important and religiously rightful to keep Al Qaeda united.,"(is, certain); (keep, certain)"
377,CMU/AFGP-2002-600175-Trans.xml,LU Factuality: That will come by fearing God in private and in public.,"(fearing, certain); (come, certain)"
378,CMU/AFGP-2002-600175-Trans.xml,"LU Factuality: The mighty Allah said, ""Who fears Allah, Allah will remove his bad deeds and reward him with good deeds.  "" ","(said, certain); (reward, uncertain); (deeds, uncertain); (deeds, uncertain); (remove, uncertain); (fears, uncertain)"
379,CMU/AFGP-2002-600175-Trans.xml,"LU Factuality: And it will come by being friendly with Al Qaeda brothers and all Muslims, by best behavior, avoiding differences, cooperation and working for the good of the group.","(cooperation, certain); (avoiding, certain); (behavior, certain); (being, certain); (working, certain); (come, certain)"
380,CMU/AFGP-2002-600175-Trans.xml,"LU Factuality: [Prophet Mohammd] said, peace upon him, ""Love and compassion and sympathy between believers is like the human body: if one part of the body is sick, all the other parts of the body will come to its aid.  "" mutafaq aley / agreed upon.","(said, certain); (peace, unknown); (between, uncertain); (compassion, uncertain); (Love, uncertain); (come, uncertain); (is, uncertain); (is, uncertain); (believers, uncertain); (agreed, certain); (aid, uncertain)"
381,CMU/AFGP-2002-600175-Trans.xml,"LU Factuality: Maintaining good Islamic behavior, avoiding all forms of belligerent play, avoiding bad company and confirming any news to the smallest detail.","(confirming, certain); (avoiding, certain); (play, certain); (avoiding, certain); (behavior, certain); (Maintaining, certain)"
382,CMU/AFGP-2002-600175-Trans.xml,"LU Factuality: Mighty Allah said, ""O believers, if a sinner comes to you with news, verify it first, lest you attack someone ignorantly and later regret it.  "" ","(said, certain); (attack, uncertain); (verify, uncertain); (comes, uncertain); (believers, uncertain); (regret, uncertain)"
383,CMU/AFGP-2002-600175-Trans.xml,LU Factuality: Maintaining good moral characteristics and obedience to the parents even if they are infidels.,"(are, certain); (to, certain); (Maintaining, certain)"
384,CMU/AFGP-2002-600175-Trans.xml,LU Factuality: Eating kosher food.,"(Eating, certain)"
385,CMU/AFGP-2002-600175-Trans.xml,"LU Factuality: Prophet Mohammad said, ""Allah is good, and He only accepts the good.""","(said, certain); (accepts, uncertain); (is, uncertain)"
386,CMU/AFGP-2002-600175-Trans.xml,LU Factuality: Maintaining as good physical fitness and military training as possible.,"(Maintaining, certain); (fitness, certain); (training, certain)"
387,CMU/AFGP-2002-600175-Trans.xml,"LU Factuality: Do not talk about work which is delegated to you to anybody, even with Al Qaeda members.","(work, certain); (delegated, certain); (talk, certain)"
388,CMU/AFGP-2002-600175-Trans.xml,LU Factuality: The only person you are authorized to talk to is your direct superior.,"(is, certain); (authorized, certain); (talk, certain)"
389,CMU/AFGP-2002-600175-Trans.xml,"LU Factuality: If you have been delegated to a mission with other people, talking among the group must be supervised by the command.","(delegated, certain); (must, certain); (mission, certain); (talking, certain)"
390,CMU/AFGP-2002-600175-Trans.xml,"LU Factuality: Maintaining strong hold on your Islamic faith in general and the call for Al Jihad ideology in particular, starting with your relatives and friends.","(Maintaining, certain); (ideology, certain); (faith, certain); (hold, certain); (starting, certain); (call, certain)"
391,CMU/AFGP-2002-600175-Trans.xml,"LU Factuality: Mighty Allah said, ""Warn your close relatives.  "" ","(said, certain); (Warn, uncertain)"
392,CMU/AFGP-2002-600175-Trans.xml,LU Factuality: Sometimes you will be prevented from spreading these ideologies because your work requires too much secrecy.,"(requires, certain); (work, certain); (ideologies, certain); (spreading, certain); (prevented, certain)"
393,CMU/AFGP-2002-600175-Trans.xml,LU Factuality: Guard the public money belonging to Al Qaeda.,"(belonging, certain); (Guard, certain)"
394,CMU/AFGP-2002-600175-Trans.xml,"LU Factuality: The Messenger of Allah said, peace upon him, ""The people who waste Allah's money, their reward will be the fire on Judgment Day.  "" ","(said, certain); (peace, unknown); (reward, uncertain); (Day, uncertain); (waste, uncertain); (be, uncertain)"
395,CMU/AFGP-2002-600175-Trans.xml,"LU Factuality: Give good advice to your superiors and Al Qaeda brothers, and don't deceive them.","(Give, certain); (deceive, certain); (advice, certain)"
396,CMU/AFGP-2002-600175-Trans.xml,LU Factuality: Take refuge in Allah from the accursed Satan.,"(refuge, certain); (refuge, certain)"
