,file,input_text,target_text
601,CMU/CNN_ENG_20030614_173123.4-NEW-1.xml,lu factuality: but hamas had already become an important part of palestinian society through its charity work and its influence increased over time by providing community services when the palestinian authority did not.,but hamas had already [become|true] an important part of palestinian society through its charity [work|true] and its [influence|true] [increased|true] over time by [providing|true] community [services|true] when the palestinian authority [did|true] not.
602,CMU/CNN_ENG_20030614_173123.4-NEW-1.xml,lu factuality: hamas plays on the palestinian authority's failure to produce.,hamas [plays|true] on the palestinian authority's [failure|true] to [produce|true].
603,CMU/CNN_ENG_20030614_173123.4-NEW-1.xml,"lu factuality: its basic message, the palestinian authority is corrupt, it fails to deliver, hamas is not corrupt.","its basic [message|true], the palestinian authority [is|false] corrupt, it [fails|false] to [deliver|false], hamas [is|false] not corrupt."
604,CMU/CNN_ENG_20030614_173123.4-NEW-1.xml,lu factuality: hamas cares about the person on the street and it does deliver.,hamas [cares|false] about the person on the street and it does [deliver|false].
605,CMU/CNN_ENG_20030614_173123.4-NEW-1.xml,"lu factuality: unfortunately, those same charitable organizations, those same charity committees that funnel the funds to needier palestinians, also serve to support terrorist attacks.","unfortunately, those same charitable organizations, those same charity committees that [funnel|true] the funds to needier palestinians, also [serve|true] to [support|unknown] terrorist [attacks|true]."
606,CMU/CNN_ENG_20030614_173123.4-NEW-1.xml,"lu factuality: israel and the united states say arafat has not been tough enough on terrorism, and have attempted to force him out of the current peace process.","israel and the united states [say|true] arafat has not [been|false] tough enough on terrorism, and have [attempted|true] to [force|false] him out of the current peace [process|true]."
607,CMU/CNN_ENG_20030614_173123.4-NEW-1.xml,lu factuality: the prime minister known as abu mazen must now contend with the rejection of side by side palestinian and israeli states.,the prime minister [known|true] as abu mazen [must|true] now [contend|unknown] with the [rejection|true] of side by side palestinian and israeli states.
608,CMU/CNN_ENG_20030614_173123.4-NEW-1.xml,lu factuality: a cornerstone of the new peace plan.,a [cornerston|true]e of the new peace [plan|true].
609,CMU/CNN_ENG_20030614_173123.4-NEW-1.xml,lu factuality: he's trying to get hamas to co- exist with israel.,he's [trying|true] to [get|unknown] hamas to co- [exist|false] with israel.
610,CMU/CNN_ENG_20030614_173123.4-NEW-1.xml,lu factuality: conservative israelis are skeptical.,conservative israelis [are|true] skeptical.
611,CMU/CNN_ENG_20030614_173123.4-NEW-1.xml,"lu factuality: he is not working against hamas, he is working in tandem.","he is not [working|true] against hamas, he is [working|true] in tandem."
612,CMU/CNN_ENG_20030614_173123.4-NEW-1.xml,lu factuality: he is negotiating with them.,he is [negotiating|true] with them.
613,CMU/CNN_ENG_20030614_173123.4-NEW-1.xml,"lu factuality: he is not telling them to disband and regulate their weapons, so i have no faith in the ability of abu mazen to put terror aside.","he is not [telling|true] them to [disband|true] and [regulate|true] their weapons, so i [have|true] no faith in the [ability|false] of abu mazen to [put|false] terror aside."
614,CMU/CNN_ENG_20030614_173123.4-NEW-1.xml,"lu factuality: reporter: settlers call the just concluded israeli-american-palestinian summit a surrender, and were not impressed.","reporter: settlers [call|true] the just concluded israeli-american-palestinian [summit|true] a [surrender|false], and [were|true] not impressed."
615,CMU/CNN_ENG_20030614_173123.4-NEW-1.xml,"lu factuality: translator: the armed intifada must end and we must use and resort to peaceful means in our quest to end the occupation and the suffering of the palestinians, and the israelis, and to establish the palestinian state.","translator: the armed intifada [must|true] [end|unknown] and we [must|true] [use|unknown] and [resort|unknown] to peaceful [means|true] in our [quest|true] to [end|true] the [occupation|true] and the [suffering|true] of the palestinians, and the israelis, and to [establish|unknown] the palestinian state."
616,CMU/CNN_ENG_20030614_173123.4-NEW-1.xml,lu factuality: hamas and other palestinian militant group rejected abbas' call to end their attacks with a deadly raid on an israeli army outpost in gaza.,hamas and other palestinian militant group [rejected|true] abbas' [call|true] to [end|unknown] their [attacks|true] with a deadly [raid|true] on an israeli army outpost in gaza.
617,CMU/CNN_ENG_20030614_173123.4-NEW-1.xml,lu factuality: we are all saying that the resistance will continue despite the summit in aqaba.,we are all [saying|true] that the [resistance|true] will [continue|true] despite the [summit|true] in aqaba.
618,CMU/CNN_ENG_20030614_173123.4-NEW-1.xml,"lu factuality: israel retaliated on hamas, namely al-rantissi, it missed him and killed civilians.","israel [retaliated|true] on hamas, namely al-rantissi, it [missed|true] him and [killed|true] civilians."
619,CMU/CNN_ENG_20030614_173123.4-NEW-1.xml,"lu factuality: translator: hamas will not drop our weapons, even if all leaders are assassinated.","translator: hamas will not [drop|true] our weapons, even if all leaders are [assassinated|false]."
620,CMU/CNN_ENG_20030614_173123.4-NEW-1.xml,"lu factuality: reporter: since the second intifada began in 2000, over 700 israelis have been killed, during the same time there have been more than 2,000 palestinian deaths according to the red crescent.","reporter: since the second intifada began in 2000, over 700 israelis have been [killed|true], during the same time there have [been|true] more than 2,000 palestinian deaths [according|true] to the red crescent."
621,CMU/CNN_ENG_20030614_173123.4-NEW-1.xml,lu factuality: including hamas leaders targeted for assassination.,including hamas leaders [targeted|true] for [assassination|true].
622,CMU/CNN_ENG_20030614_173123.4-NEW-1.xml,"lu factuality: if you want an end to terrorism, if you want an end to violence, you have to give people hope and you have to give them a stake in the political process.","if you [want|true] an end to terrorism, if you [want|true] an end to violence, you [have|true] to [give|unknown] people [hope|true] and you [have|true] to [give|unknown] them a [stake|true] in the political [process|true]."
623,CMU/CNN_ENG_20030614_173123.4-NEW-1.xml,"lu factuality: i think that hamas is ready to join the political process, however, if the only price for the political price is you must fight hamas, if that's what they are requiring abu mazen to do, they are almost mandating that he will fail.","i [think|true] that hamas [is|true] ready to [join|false] the political [process|true], however, if the only price for the political price is you [must|true] fight hamas, if that's what they are [requiring|true] abu mazen to [do|unknown], they are almost [mandating|true] that he will [fail|true]."
624,CMU/CNN_ENG_20030614_173123.4-NEW-1.xml,"lu factuality: the main test of mahmoud abbas, will be to establish an overall command of all armed groups, if not, it doesn't have a chance.","the main [test|true] of mahmoud abbas, will [be|true] to establish an overall [command|true] of all armed groups, if not, it doesn't [have|true] a chance."
625,CMU/CNN_ENG_20030614_173123.4-NEW-1.xml,"lu factuality: you know, leaders have to do things","you [know|true], leaders [have|true] to [do|unknown] things"
626,CMU/ENRON-pearson-email-25jul02.xml,lu factuality: Subject: RE: Unclassified rules,Subject: RE: Unclassified [rules|true]
627,CMU/ENRON-pearson-email-25jul02.xml,lu factuality: WHAT'S BEEN GOING ON AMIGO.  ,WHAT'S BEEN [GOING|unknown] ON AMIGO.  
628,CMU/ENRON-pearson-email-25jul02.xml,lu factuality: I HAVE NOT TALKED TO YOU IN A WHILE.  ,I HAVE NOT [TALKED|true] TO YOU IN A WHILE.  
629,CMU/ENRON-pearson-email-25jul02.xml,lu factuality: GIVE YOU THE SCOPE OF WHATS BEEN GOING ON WITH ME.  ,[GIVE|true] YOU THE [SCOPE|true] OF WHATS BEEN [GOING|true] ON WITH ME.  
630,CMU/ENRON-pearson-email-25jul02.xml,lu factuality: I LEFT OILSTATES BACK IN MARCH WITH ANOTHER COMPANY.  ,I [LEFT|true] OILSTATES BACK IN MARCH WITH ANOTHER COMPANY.  
631,CMU/ENRON-pearson-email-25jul02.xml,lu factuality: DID A LOT OF TRAVELING AND THEY (OILSTATES) MADE ME A SWEET OFFER TO COME BACK.,[DID|true] A LOT OF [TRAVELING|true] AND THEY (OILSTATES) [MADE|true] ME A SWEET [OFFER|true] TO [COME|true] BACK.
632,CMU/ENRON-pearson-email-25jul02.xml,lu factuality: SO I AM BACK.,SO I [AM|true] BACK.
633,CMU/ENRON-pearson-email-25jul02.xml,lu factuality: WHO'S GETTING MARRIED?  ,WHO'S [GETTING|unknown] MARRIED?  
634,CMU/ENRON-pearson-email-25jul02.xml,lu factuality: SOUNDS LIKE THIS IS GOING TO BE A GREAT BACHELOR PARTY.  ,[SOUNDS|true] LIKE THIS IS GOING TO [BE|true] A GREAT BACHELOR PARTY.  
635,CMU/ENRON-pearson-email-25jul02.xml,lu factuality: GIVE ME A CALL SOMETIME CELL: 713 991 - 5621.,[GIVE|true] ME A [CALL|false] SOMETIME CELL: 713 991 - 5621.
636,CMU/IZ-060316-01-Trans-1.xml,"lu factuality: IN THE NAME OF GOD, MOST GRACIOUS MOST MERCYFUL ","IN THE NAME OF GOD, MOST GRACIOUS [MOST|unknown] MERCYFUL "
637,CMU/IZ-060316-01-Trans-1.xml,"lu factuality: So this is the reality we're living in al-Anbar in general, and Ramadi in particular, that is the head Sheiks of some tribes, and symbols of the Islamic Party, sat with the Americans in Jordan, and other places, to fight terrorism and its people.","So this [is|true] the reality we're [living|true] in al-Anbar in general, and Ramadi in particular, that [is|true] the head Sheiks of some tribes, and [symbols|true] of the Islamic Party, [sat|true] with the Americans in Jordan, and other places, to [fight|unknown] [terrorism|true] and its people."
638,CMU/IZ-060316-01-Trans-1.xml,"lu factuality: The Sheiks started teaching people about these ideas, this conspiracy is led by two sides, the first is the heads of the tribes, the second is the leaders of the Islamic Party and mosques speakers, so they announced their war on the Mujahidin, it increased during the elections for the new constitution, their danger was so great, that hundreds of people volunteered in the police and the army, and thousands of people participated in the elections, renouncing their religion, and listenning to the erratics.","The Sheiks [started|true] [teaching|true] people about these ideas, this [conspiracy|true] is [led|true] by two sides, the first [is|true] the heads of the tribes, the second [is|true] the leaders of the Islamic Party and mosques speakers, so they [announced|true] their [war|true] on the Mujahidin, it [increased|true] during the [elections|true] for the new constitution, their [danger|true] [was|true] so great, that hundreds of people [volunteered|true] in the police and the army, and thousands of people [participated|true] in the [elections|true], [renouncing|true] their religion, and [listenning|true] to the erratics."
639,CMU/IZ-060316-01-Trans-1.xml,"lu factuality: After we took a look at the situation, we found that the best solutions to stop thousands of people from renouncing their religion, is to cut the heads of the Sheiks of infidelity and erratic.","After we [took|true] a look at the [situation|true], we [found|true] that the best [solutions|true] to [stop|unknown] thousands of people from [renouncing|true] their religion, [is|true] to cut the heads of the Sheiks of infidelity and erratic."
640,CMU/IZ-060316-01-Trans-1.xml,"lu factuality: Before we start reviewing the events that accured here, we ask two questions:","Before we [start|true] [reviewing|true] the [events|true] that [accured|true] here, we [ask|true] two [questions|true]:"
641,CMU/IZ-060316-01-Trans-1.xml,"lu factuality: If there were people who are raping thousands of muslim women taking their honor, and stealing muslim money and land, and other people who don't rape or steal, but they take the religion away from thousands of muslims, what's more important, religion, or honor and land?","If there [were|false] people who are [raping|false] thousands of muslim women [taking|false] their honor, and [stealing|false] muslim money and land, and other people who don't [rape|false] or [steal|false], but they [take|false] the religion away from thousands of muslims, what['s|unknown] more important, religion, or honor and land?"
642,CMU/IZ-060316-01-Trans-1.xml,"lu factuality: What we learned from muslim scholars is that robbing the religion from muslims, is greater than robbing their honor and land, god said ""turmoil is greater than murder"", and for those devils, their danger is greater than who rapes, or rob and steal money or land.","What we [learned|true] from muslim scholars is that [robbing|true] the religion from muslims, [is|true] greater than [robbing|true] their honor and land, god [said|true] ""[turmoil|false] [is|false] greater than [murder|false]"", and for those devils, their [danger|true] [is|true] greater than who [rapes|true], or [rob|true] and steal money or land."
643,CMU/IZ-060316-01-Trans-1.xml,lu factuality: Second question:,Second [question|true]:
644,CMU/IZ-060316-01-Trans-1.xml,"lu factuality: Why did we announce and started fighting the Shiites and police from the start, even thought most of the Jihadist sectors and the public didn't understand what we want, and didn't know the importance of starting with those, so what's the objection on killing and executing the Sheiks now and without a notice, with continiuing making people understand it, just like we did by killing the police then, were people satisfied with us?","Why did we [announce|unknown] and [started|unknown] [fighting|true] the Shiites and police from the start, even thought most of the Jihadist sectors and the public didn't [understand|true] what we [want|true], and didn't [know|true] the [importance|true] of [starting|true] with those, so what['s|unknown] the objection on [killing|true] and [executing|true] the Sheiks now and without a notice, with [continiuing|true] [making|true] people understand it, just like we [did|true] by [killing|true] the police then, [were|unknown] people [satisfied|unknown] with us?"
645,CMU/IZ-060316-01-Trans-1.xml,lu factuality: Actually lot of the public thinks that who killed the police is Badr organization or gangs from Iran ! and that who's killing Shiites is hired by Israel and the U.S. to start an ethnic war and so on.,Actually lot of the public [thinks|true] that who [killed|true] the police [is|true] Badr organization or gangs from Iran ! and that who's [killing|true] Shiites is [hired|true] by Israel and the U.S. to [start|unknown] an ethnic [war|false] and so on.
646,CMU/IZ-060316-01-Trans-1.xml,"lu factuality: From what we saw, the damage caused by those erratic infidels (Tribes Sheiks, The Islamic Party) is more dangerous than the Shiites and the peaceful police as people call them.","From what we [saw|true], the [damage|true] [caused|true] by those erratic infidels (Tribes Sheiks, The Islamic Party) [is|true] more dangerous than the Shiites and the peaceful police as people [call|true] them."
647,CMU/IZ-060316-01-Trans-1.xml,"lu factuality: You Sheik announced war on those, with the opposings of many sectors and scholars of decision making.","You Sheik [announced|true] [war|true] on those, with the [opposings|true] of many sectors and scholars of decision [making|true]."
648,CMU/IZ-060316-01-Trans-1.xml,"lu factuality: The brothers now are wiping out the heads of infidelity, as soon as they started, and never claiming responsibility, we found among us who wants to make fuss about it, and regretfully some of the brothers with us in the organization (al- Qa'ida) see it as nonsense, and god is my witness.","The brothers now are [wiping|true] out the heads of infidelity, as soon as they [started|true], and never [claiming|true] responsibility, we [found|true] among us who [wants|true] to [make|unknown] fuss about it, and regretfully some of the brothers with us in the [organization|true] (al- Qa'ida) [see|true] it as nonsense, and god [is|unknown] my witness."
649,CMU/IZ-060316-01-Trans-1.xml,"lu factuality: My Sheik, here's some of the events that happened in Ramadi:","My Sheik, here['s|true] some of the events that [happened|true] in Ramadi:"
650,CMU/IZ-060316-01-Trans-1.xml,"lu factuality: Sheik Nasr al-Fahdawi, Sheik of AlbuFahd tribe, was nominated to be the governor of Anbar, this man worked so hard fighting the (Tanzim)organization, with all he's got, from money to power, and reputation in Ramadi, so we tried this with him:","Sheik Nasr al-Fahdawi, Sheik of AlbuFahd tribe, was [nominated|true] to [be|false] the governor of Anbar, this man [worked|true] so hard [fighting|true] the [(Tanzim)organization|true], with all he's [got|true], from money to [power|true], and [reputation|true] in Ramadi, so we [tried|true] this with him:"
651,CMU/IZ-060316-01-Trans-1.xml,"lu factuality: First, we backed off during the elections, they had checkpoints, using tens of his tribesmen who started checking cars, they violated our brothers many  times, they even announced it, then our brothers attacked the field leader, the brain behind people revolting at al-Anbar in AlbuFahd, so the brothers raided his house in the middle of the night wearing the national guards uniform and driving similar cars, they took him and killed him thank god.","First, we [backed|true] off during the [elections|true], they [had|true] checkpoints, [using|true] tens of his tribesmen who [started|true] [checking|true] cars, they [violated|true] our brothers many  times, they even [announced|true] it, then our brothers [attacked|true] the field leader, the brain [behind|true] people [revolting|true] at al-Anbar in AlbuFahd, so the brothers [raided|true] his house in the middle of the night [wearing|true] the national guards uniform and [driving|true] similar cars, they [took|true] him and [killed|true] him [thank|unknown] god."
652,CMU/IZ-060316-01-Trans-1.xml,"lu factuality: The next morning his households and neighbors started talking to the tribe saying it was the national guards, they added that they heard some of them speaking English, meaning that  the Americans are the ones who took Abu Dhari (Sheik Nasr al-Fahdawi), no one claimed responsibility for his killing, thank god.","The next morning his households and neighbors [started|true] [talking|true] to the tribe [saying|true] it [was|false] the national guards, they [added|true] that they heard some of them speaking English, [meaning|true] that  the Americans [are|true] the ones who [took|true] Abu Dhari (Sheik Nasr al-Fahdawi), no one [claimed|true] responsibility for his [killing|true], [thank|unknown] god."
653,CMU/IZ-060316-01-Trans-1.xml,"lu factuality: Around the same period, our brothers on the other side of Uphrate river, killed Jasim al-`Awwad in al-Malahima and AlbuHazim, he's considered as important as Abu Dhari in AlbuFahd, he's a big spy / agent, invited Americans to his house for big dinner parties many times, regardless, our brothers didn't claim resposibility for killing him.","Around the same period, our brothers on the other side of Uphrate river, [killed|true] Jasim al-`Awwad in al-Malahima and AlbuHazim, he's [considered|true] as [important|true] as Abu Dhari in AlbuFahd, he['s|true] a big spy / agent, [invited|true] Americans to his house for big dinner [parties|true] many times, regardless, our brothers didn't [claim|true] resposibility for [killing|true] him."
654,CMU/IZ-060316-01-Trans-1.xml,"lu factuality: After our brothers killed three of the infidels in AlbuFahd, some of them claimed he's for Jihad, at the same time, protects with his soldiers the election centers, and encourages people to volunteers in the police force and the Iraqi army, and it was the second hit for Nasr al-Fahdawi.","After our brothers [killed|true] three of the infidels in AlbuFahd, some of them [claimed|true] he['s|false] for Jihad, at the same time, [protects|true] with his soldiers the election centers, and [encourages|true] people [to|false] volunteers in the police force and the Iraqi army, and it [was|true] the second hit for Nasr al-Fahdawi."
655,CMU/IZ-060316-01-Trans-1.xml,"lu factuality: In the morning infidels announced in their satellite channels that Nasr al-Fahdawi welcomed Ibrahim al-Ja'fari in Ramadi, then by noon, they announced his assasination, thank god.","In the morning infidels [announced|true] in their satellite channels that Nasr al-Fahdawi [welcomed|true] Ibrahim al-Ja'fari in Ramadi, then by noon, they [announced|true] his [assasination|true], [thank|unknown] god."
656,CMU/IZ-060316-01-Trans-1.xml,"lu factuality: Then there was a complete change of events than is was before thank god, cousins of Sheik Nasr came to the Mujahidin begging, announcing their repentance and innocense, saying we're with you, we'll do whatever you want.","Then there [was|true] a complete change of [events|true] than is was before thank [god|unknown], cousins of Sheik Nasr [came|true] to the Mujahidin [begging|true], [announcing|true] their [repentance|true] and [innocense|true], [saying|true] we['re|false] with you, we'll [do|true] whatever you [want|true]."
657,CMU/IZ-060316-01-Trans-1.xml,"lu factuality: The turmoil is over, our brothers now are roaming the streets of AlbuFahd without any checkpoints.","The [turmoil|true] [is|true] over, our brothers now are [roaming|true] the streets of AlbuFahd [without|true] any checkpoints."
658,CMU/IZ-060316-01-Trans-1.xml,"lu factuality: For the other tribes, their reaction was as follows:","For the other tribes, their [reaction|true] [was|true] as follows:"
659,CMU/IZ-060316-01-Trans-1.xml,"lu factuality: Sheik of al-Bubali tribe in al-Jazira, Sheik Sarhan, who's one of the traitors, and every time one of their traitors gets killed, he shows outrage and packs his tribe with their guns against the brothers, after the cleaning in AlbuFahd, the brothers killed three of the spies in his tribe, and for the first time there was no reaction against the brothers, but instead he came to them, asking for forgiveness, and he's ready to cooperate.","Sheik of al-Bubali tribe in al-Jazira, Sheik Sarhan, who['s|true] one of the traitors, and every time one of their traitors gets [killed|true], he [shows|true] outrage and [packs|true] his tribe with their guns against the brothers, after the [cleaning|true] in AlbuFahd, the brothers [killed|true] three of the spies in his tribe, and for the first time there [was|true] no reaction against the brothers, but instead he [came|true] to them, [asking|true] for [forgiveness|true], and he['s|true] ready to cooperate."
660,CMU/IZ-060316-01-Trans-1.xml,"lu factuality: Sheik of Albu'Ubaid (Salah al-Dhari), who slaughtered thirty sheeps in one dinner party, where he invited heads and Sheiks of tribes in Ramadi, to encourage their youth to join the police and the national guard, and that's two days before the murder of Sheik Nasr al-Fahdawi, after that he announced his repentance at the mosque twice infront of Albu'Ubaid tribe, denouncing who joins the police and army, and sorry for all he's done, without any pressure or threats from the brothers, also the brothers didn't announce the claim for any of the killings.","Sheik of Albu'Ubaid (Salah al-Dhari), who [slaughtered|true] thirty sheeps in one dinner [party|true], where he [invited|true] heads and Sheiks of tribes in Ramadi, to [encourage|unknown] their youth to [join|false] the police and the national guard, and that['s|true] two days before the [murder|true] of Sheik Nasr al-Fahdawi, after that he [announced|true] his [repentance|true] at the mosque twice infront of Albu'Ubaid tribe, [denouncing|true] who [joins|true] the police and army, and [sorry|true] for all he's [done|true], [without|true] any pressure or [threats|true] from the brothers, also the brothers didn't [announce|true] the [claim|true] for any of the [killings|true]."
661,CMU/IZ-060316-01-Trans-1.xml,"lu factuality: When Mazhar al-`Alawani a candidate for the elections was murdered, his pictures were all over Ramadi, where the entire Albu'Alwan tribe was supporting him, proud of him, one day before the elections, the brothers killed him while he was visiting Ramadi, no one from his tribe openned his mouth, instead they  got more scared and weaker.","When Mazhar al-`Alawani a candidate for the elections was [murdered|true], his pictures [were|true] all over Ramadi, where the entire Albu'Alwan tribe was [supporting|true] him, [proud|true] of him, one day before the [elections|true], the brothers [killed|true] him while he was [visiting|true] Ramadi, no one from his tribe [openned|true] his mouth, instead they  [got|true] more scared and weaker."
